{
  "id": "art-model-1",
  "kind": "model",
  "digest": "sha256:049346da55de45021706be816e8d5317b2ab320e785d2ba96f22b63acddb7053",
  "media_type": "application/octet-stream",
  "size_bytes": 4194304,
  "uri": "http://worker.internal:9000/v1/assignments/asg_01J8R9T2M4K7QW3N8V5C1XZBAE/artifacts/art-model-1",
  "title": "cost-centre-clf@3.2.0"
}
